{
  "$schema": "../schema/official-defaults.schema.json",
  "schemaVersion": "1",
  "id": "official-defaults",
  "channel": "stable",
  "revision": "1.2.0",
  "defaultPluginId": "beat-lyric-cuts",
  "plugins": [
    {
      "id": "beat-lyric-cuts",
      "version": "1.0.0",
      "order": 0,
      "installMode": "preinstalled",
      "updatePolicy": "notify"
    },
    {
      "id": "mineradio",
      "version": "1.1.2",
      "order": 10,
      "installMode": "preinstalled",
      "updatePolicy": "notify"
    },
    {
      "id": "sonic-topography",
      "version": "1.0.2",
      "order": 20,
      "installMode": "recommended",
      "updatePolicy": "notify"
    }
  ],
  "updatedAt": "2026-07-12T00:00:00Z"
}
